{
  "schema_version": "1.0.0",
  "record_class": "OPERATIONAL",
  "snapshot_id": "tracera-state-forward-20261017-q1",
  "previous_snapshot_id": null,
  "product_id": "Tracera",
  "subject_id": "3fd3310fb98fdd2f9bca99eddd669f974fb1fb61",
  "baseline_id": "unified-intent-20261017-selected-assessment-v1",
  "as_of": "2026-10-17T09:39:28.530213+00:00",
  "evidence": [
    {
      "id": "E-Q1",
      "kind": "EXECUTED_PRODUCT",
      "subject_id": "3fd3310fb98fdd2f9bca99eddd669f974fb1fb61",
      "observed_at": "2026-10-17T09:34:03.568105+00:00",
      "valid_until": null,
      "locator": "raw/q1-delivery.json",
      "sha256": "9492c4dca046f50c1d5bffcd01dde5747e70878b7e554f8e1b5a2c1c28a157aa"
    }
  ],
  "leaves": [
    {
      "id": "G01-engineering",
      "title": "Authority and mature identity",
      "axis": "engineering",
      "weight": 1,
      "applicability": "APPLICABLE",
      "exclusion_authority": null,
      "status": "UNKNOWN",
      "review": "PROPOSED",
      "critical": true,
      "evidence_ids": []
    },
    {
      "id": "G01-usable",
      "title": "Authority and mature identity",
      "axis": "usable",
      "weight": 1,
      "applicability": "APPLICABLE",
      "exclusion_authority": null,
      "status": "UNKNOWN",
      "review": "PROPOSED",
      "critical": true,
      "evidence_ids": []
    },
    {
      "id": "G01-assurance",
      "title": "Authority and mature identity",
      "axis": "assurance",
      "weight": 1,
      "applicability": "APPLICABLE",
      "exclusion_authority": null,
      "status": "UNKNOWN",
      "review": "PROPOSED",
      "critical": true,
      "evidence_ids": []
    },
    {
      "id": "G02-engineering",
      "title": "Local trace capture",
      "axis": "engineering",
      "weight": 1,
      "applicability": "APPLICABLE",
      "exclusion_authority": null,
      "status": "UNKNOWN",
      "review": "PROPOSED",
      "critical": false,
      "evidence_ids": []
    },
    {
      "id": "G02-usable",
      "title": "Local trace capture",
      "axis": "usable",
      "weight": 1,
      "applicability": "APPLICABLE",
      "exclusion_authority": null,
      "status": "UNKNOWN",
      "review": "PROPOSED",
      "critical": false,
      "evidence_ids": []
    },
    {
      "id": "G02-assurance",
      "title": "Local trace capture",
      "axis": "assurance",
      "weight": 1,
      "applicability": "APPLICABLE",
      "exclusion_authority": null,
      "status": "UNKNOWN",
      "review": "PROPOSED",
      "critical": false,
      "evidence_ids": []
    },
    {
      "id": "G03-engineering",
      "title": "Cross-run dependency reasoning",
      "axis": "engineering",
      "weight": 1,
      "applicability": "APPLICABLE",
      "exclusion_authority": null,
      "status": "UNKNOWN",
      "review": "PROPOSED",
      "critical": false,
      "evidence_ids": []
    },
    {
      "id": "G03-usable",
      "title": "Cross-run dependency reasoning",
      "axis": "usable",
      "weight": 1,
      "applicability": "APPLICABLE",
      "exclusion_authority": null,
      "status": "UNKNOWN",
      "review": "PROPOSED",
      "critical": false,
      "evidence_ids": []
    },
    {
      "id": "G03-assurance",
      "title": "Cross-run dependency reasoning",
      "axis": "assurance",
      "weight": 1,
      "applicability": "APPLICABLE",
      "exclusion_authority": null,
      "status": "UNKNOWN",
      "review": "PROPOSED",
      "critical": false,
      "evidence_ids": []
    },
    {
      "id": "G04-engineering",
      "title": "Memory distillation",
      "axis": "engineering",
      "weight": 1,
      "applicability": "APPLICABLE",
      "exclusion_authority": null,
      "status": "UNKNOWN",
      "review": "PROPOSED",
      "critical": true,
      "evidence_ids": []
    },
    {
      "id": "G04-usable",
      "title": "Memory distillation",
      "axis": "usable",
      "weight": 1,
      "applicability": "APPLICABLE",
      "exclusion_authority": null,
      "status": "UNKNOWN",
      "review": "PROPOSED",
      "critical": true,
      "evidence_ids": []
    },
    {
      "id": "G04-assurance",
      "title": "Memory distillation",
      "axis": "assurance",
      "weight": 1,
      "applicability": "APPLICABLE",
      "exclusion_authority": null,
      "status": "UNKNOWN",
      "review": "PROPOSED",
      "critical": true,
      "evidence_ids": []
    },
    {
      "id": "G05-engineering",
      "title": "Audit and evidence replay",
      "axis": "engineering",
      "weight": 1,
      "applicability": "APPLICABLE",
      "exclusion_authority": null,
      "status": "UNKNOWN",
      "review": "PROPOSED",
      "critical": false,
      "evidence_ids": []
    },
    {
      "id": "G05-usable",
      "title": "Audit and evidence replay",
      "axis": "usable",
      "weight": 1,
      "applicability": "APPLICABLE",
      "exclusion_authority": null,
      "status": "UNKNOWN",
      "review": "PROPOSED",
      "critical": false,
      "evidence_ids": []
    },
    {
      "id": "G05-assurance",
      "title": "Audit and evidence replay",
      "axis": "assurance",
      "weight": 1,
      "applicability": "APPLICABLE",
      "exclusion_authority": null,
      "status": "UNKNOWN",
      "review": "PROPOSED",
      "critical": false,
      "evidence_ids": []
    },
    {
      "id": "G06-engineering",
      "title": "Product semantic model",
      "axis": "engineering",
      "weight": 1,
      "applicability": "APPLICABLE",
      "exclusion_authority": null,
      "status": "UNKNOWN",
      "review": "PROPOSED",
      "critical": false,
      "evidence_ids": []
    },
    {
      "id": "G06-usable",
      "title": "Product semantic model",
      "axis": "usable",
      "weight": 1,
      "applicability": "APPLICABLE",
      "exclusion_authority": null,
      "status": "UNKNOWN",
      "review": "PROPOSED",
      "critical": false,
      "evidence_ids": []
    },
    {
      "id": "G06-assurance",
      "title": "Product semantic model",
      "axis": "assurance",
      "weight": 1,
      "applicability": "APPLICABLE",
      "exclusion_authority": null,
      "status": "UNKNOWN",
      "review": "PROPOSED",
      "critical": false,
      "evidence_ids": []
    },
    {
      "id": "G07-engineering",
      "title": "Import and canonical identity",
      "axis": "engineering",
      "weight": 1,
      "applicability": "APPLICABLE",
      "exclusion_authority": null,
      "status": "UNKNOWN",
      "review": "PROPOSED",
      "critical": false,
      "evidence_ids": []
    },
    {
      "id": "G07-usable",
      "title": "Import and canonical identity",
      "axis": "usable",
      "weight": 1,
      "applicability": "APPLICABLE",
      "exclusion_authority": null,
      "status": "UNKNOWN",
      "review": "PROPOSED",
      "critical": false,
      "evidence_ids": []
    },
    {
      "id": "G07-assurance",
      "title": "Import and canonical identity",
      "axis": "assurance",
      "weight": 1,
      "applicability": "APPLICABLE",
      "exclusion_authority": null,
      "status": "UNKNOWN",
      "review": "PROPOSED",
      "critical": false,
      "evidence_ids": []
    },
    {
      "id": "G08-engineering",
      "title": "Project catalog and CIVIS",
      "axis": "engineering",
      "weight": 1,
      "applicability": "APPLICABLE",
      "exclusion_authority": null,
      "status": "UNKNOWN",
      "review": "PROPOSED",
      "critical": false,
      "evidence_ids": []
    },
    {
      "id": "G08-usable",
      "title": "Project catalog and CIVIS",
      "axis": "usable",
      "weight": 1,
      "applicability": "APPLICABLE",
      "exclusion_authority": null,
      "status": "UNKNOWN",
      "review": "PROPOSED",
      "critical": false,
      "evidence_ids": []
    },
    {
      "id": "G08-assurance",
      "title": "Project catalog and CIVIS",
      "axis": "assurance",
      "weight": 1,
      "applicability": "APPLICABLE",
      "exclusion_authority": null,
      "status": "UNKNOWN",
      "review": "PROPOSED",
      "critical": false,
      "evidence_ids": []
    },
    {
      "id": "G09-engineering",
      "title": "Named artifact fidelity",
      "axis": "engineering",
      "weight": 1,
      "applicability": "APPLICABLE",
      "exclusion_authority": null,
      "status": "UNKNOWN",
      "review": "PROPOSED",
      "critical": false,
      "evidence_ids": []
    },
    {
      "id": "G09-usable",
      "title": "Named artifact fidelity",
      "axis": "usable",
      "weight": 1,
      "applicability": "APPLICABLE",
      "exclusion_authority": null,
      "status": "UNKNOWN",
      "review": "PROPOSED",
      "critical": false,
      "evidence_ids": []
    },
    {
      "id": "G09-assurance",
      "title": "Named artifact fidelity",
      "axis": "assurance",
      "weight": 1,
      "applicability": "APPLICABLE",
      "exclusion_authority": null,
      "status": "UNKNOWN",
      "review": "PROPOSED",
      "critical": false,
      "evidence_ids": []
    },
    {
      "id": "G10-engineering",
      "title": "Specifications Hub",
      "axis": "engineering",
      "weight": 1,
      "applicability": "APPLICABLE",
      "exclusion_authority": null,
      "status": "UNKNOWN",
      "review": "PROPOSED",
      "critical": false,
      "evidence_ids": []
    },
    {
      "id": "G10-usable",
      "title": "Specifications Hub",
      "axis": "usable",
      "weight": 1,
      "applicability": "APPLICABLE",
      "exclusion_authority": null,
      "status": "UNKNOWN",
      "review": "PROPOSED",
      "critical": false,
      "evidence_ids": []
    },
    {
      "id": "G10-assurance",
      "title": "Specifications Hub",
      "axis": "assurance",
      "weight": 1,
      "applicability": "APPLICABLE",
      "exclusion_authority": null,
      "status": "UNKNOWN",
      "review": "PROPOSED",
      "critical": false,
      "evidence_ids": []
    },
    {
      "id": "G11-engineering",